type	disc	id	competitor_price	product_name	our_price	inventory	demand_score	img_url	timestamp	url			
phone		B0FQG1TPG9	https://www.amazon.in/-/bn/dp/B0FQG1TPG9/	"iPhone Air 1 TB: পাতলা iPhone সর্বদা, 16.63 cm (6.5″) ডিসপ্লে 120Hz পর্যন্ত প্রোমোশন সহ, শক্তিশালী A19 Pro চিপ, সেন্টার স্টেজ ফ্রন্ট ক্যামেরা, সারাদিনের ব্যাটারি লাইফ; আকাশী নীল"	138890	10		https://m.media-amazon.com/images/I/61Ce-6B6x+L._AC_UY654_QL65_.jpg	INR	https://www.amazon.in/-/bn/dp/B0FQG1TPG9/	100		
phone		B0G2B251KD	https://www.amazon.in/dp/B0G2B251KD/	REDMI 15C 5G মুনলাইট ব্লু 6GB + 128GB | রয়্যাল ডিজাইন | বিশাল 6000mAh ব্যাটারি | সেগমেন্টের বৃহত্তম ডিসপ্লে 17.53cm 120Hz পর্যন্ত | MediaTek Dimensity 6300 | 33W দ্রুত চার্জিং | 50MP AI ডুয়াল	13999	10		https://m.media-amazon.com/images/I/81eElSw1tJL._AC_UY654_QL65_.jpg	INR	https://www.amazon.in/dp/B0G2B251KD/	100		
phone		B0DPS7FB4J	https://www.amazon.in/dp/B0DPS7FB4J/	OnePlus 13 | OnePlus AI সহ স্মার্ট | লাইফটাইম ডিসপ্লে ওয়ারেন্টি |12GB RAM 256GB স্টোরেজ মিডনাইট ওশান | BGMS 2025 এর জন্য অফিসিয়াল স্মার্টফোন	63999	10		https://m.media-amazon.com/images/I/71N4hshhfNL._AC_UY654_QL65_.jpg	INR	https://www.amazon.in/dp/B0DPS7FB4J/	100		
phone		B0FHM2KCNG	https://www.amazon.in/-/bn/dp/B0FHM2KCNG/	"realme C71 4G স্মার্টফোন 4GB+64GB নীল, 6.745 inch স্ক্রিন, 90Hz আই কমফোর্ট ডিসপ্লে, 6300mAh ব্যাটারি, 37MP ক্যামেরা, Unisoc T7250 চিপ, IP54"	7899	10		https://m.media-amazon.com/images/I/51yYGfR3hLL._AC_UY654_QL65_.jpg	INR	https://www.amazon.in/-/bn/dp/B0FHM2KCNG/	100		
phone		B0FQG1TPG9	https://www.amazon.in/-/bn/dp/B0FQG1TPG9/	"iPhone Air 1 TB: পাতলা iPhone সর্বদা, 16.63 cm (6.5″) ডিসপ্লে 120Hz পর্যন্ত প্রোমোশন সহ, শক্তিশালী A19 Pro চিপ, সেন্টার স্টেজ ফ্রন্ট ক্যামেরা, সারাদিনের ব্যাটারি লাইফ; আকাশী নীল"	138890	10		https://m.media-amazon.com/images/I/61Ce-6B6x+L._AC_UY654_QL65_.jpg	INR	https://www.amazon.in/-/bn/dp/B0FQG1TPG9/	100		
phone		B0FKN95GMN	https://www.amazon.in/-/bn/dp/B0FKN95GMN/	"Motorola g86 Power 5G (প্যানটোন স্পেলবাউন্ড, 8GB RAM, 128GB স্টোরেজ) | 6.7"" 1.5K pOLED ডিসপ্লে | 50MP Sony OIS ক্যামেরা | 6720mAh ব্যাটারি | TurboPower 33W চার্জিং | ডাইমেনসিটি 7400 প্রসেসর"	17348	10		https://m.media-amazon.com/images/I/4127pxUDQqL._AC_UY654_QL65_.jpg	INR	https://www.amazon.in/-/bn/dp/B0FKN95GMN/	100		
phone		B0FL7ZRS5G	https://www.amazon.in/-/bn/dp/B0FL7ZRS5G/	"Tecno Spark GO 5G (স্কাই ব্লু, 4GB+128GB) | 6000mAh ব্যাটারি সহ স্লিমস্ট স্মার্টফোন | Ella AI ভারতীয় ভাষার সাপোর্ট সহ* | IP64 ধুলো এবং জল প্রতিরোধী"	10999	10		https://m.media-amazon.com/images/I/51stkIj-ICL._AC_UY654_QL65_.jpg	INR	https://www.amazon.in/-/bn/dp/B0FL7ZRS5G/	100		
phone		B0FTR5NGHJ	https://www.amazon.in/-/bn/dp/B0FTR5NGHJ/	OnePlus 15 | 12GB+256GB | অসীম কালো | ভারতের প্রথম Snapdragon 8 Elite Gen 5 | 7300mAh ব্যাটারি | ব্যক্তিগতকৃত AI | গেম-চেঞ্জিং 165Hz ডিসপ্লে | 4K 120fps Dolby Vision সহ ট্রিপল 50MP ক্যামেরা	72999	10		https://m.media-amazon.com/images/I/61KXgizurpL._AC_UY654_QL65_.jpg	INR	https://www.amazon.in/-/bn/dp/B0FTR5NGHJ/	100		
phone		B0F7RB8NNL	https://www.amazon.in/-/bn/dp/B0F7RB8NNL/	"Nothing Phone (3), কালো (16GB, 512 GB)"	54500	10		https://m.media-amazon.com/images/I/51E1ItTOFGL._AC_UY645_QL65_.jpg	INR	https://www.amazon.in/-/bn/dp/B0F7RB8NNL/	100		
phone		B0D37Y31YB	https://www.amazon.in/-/bn/dp/B0D37Y31YB/	"Motorola Edge 50 Pro (কালো সৌন্দর্য, 12+256)"	24740	10		https://m.media-amazon.com/images/I/51RJVdKC9lL._AC_UY654_QL65_.jpg	INR	https://www.amazon.in/-/bn/dp/B0D37Y31YB/	100		
phone		B0F13PYCJD	https://www.amazon.in/-/bn/dp/B0F13PYCJD/	"Lava Gem 2025 ডুয়াল সিম কিপ্যাড ফোন (2.8"" ডিসপ্লে, ক্যামেরা এবং ফ্ল্যাশ) | 2575mAh স্মার্ট AI শক্তিশালী ব্যাটারি | ওয়্যারলেস FM এবং রেকর্ডিং | স্টেরিও স্পিকার | কল রেকর্ডিং (কালো গোল্ড)"	1627	10		https://m.media-amazon.com/images/I/61WWSMaP9GL._AC_UY654_QL65_.jpg	INR	https://www.amazon.in/-/bn/dp/B0F13PYCJD/	100		
phone		B0FTRYH3XM	https://www.amazon.in/dp/B0FTRYH3XM/	OnePlus 15 | 12GB+256GB | আল্ট্রা ভায়োলেট | ভারতের প্রথম Snapdragon 8 Elite Gen 5 | 7300mAh ব্যাটারি | পার্সোনালাইজড AI | গেম-চেঞ্জিং 165Hz ডিসপ্লে | 4K 120fps Dolby Vision সহ ট্রিপল 50MP ক্যামেরা	72999	10		https://m.media-amazon.com/images/I/61-FxePR8IL._AC_UY654_QL65_.jpg	INR	https://www.amazon.in/dp/B0FTRYH3XM/	100		
phone		B0FZSWZZW2	https://www.amazon.in/dp/B0FZSWZZW2/	OnePlus 15R | 12GB+256GB | চারকোল ব্ল্যাক | বিশ্বের প্রথম Snapdragon 8 Gen 5 | 7400mAh ব্যাটারি | ব্যক্তিগতকৃত AI | গেম-চেঞ্জিং 165Hz ডিসপ্লে | IP68 IP69 IP66 এবং IP69K | 4K 120fps ভিডিও	47998	10		https://m.media-amazon.com/images/I/61AsNTuJ6mL._AC_UY654_QL65_.jpg	INR	https://www.amazon.in/dp/B0FZSWZZW2/	100		
phone		B09WRKHWP7	https://www.amazon.in/-/bn/dp/B09WRKHWP7/	"OnePlus 10R 5G (ফরেস্ট গ্রিন, 12GB RAM, 256GB স্টোরেজ, 80W SuperVOOC)"	34999	10		https://m.media-amazon.com/images/I/71mef2tI0zL._AC_UY654_QL65_.jpg	INR	https://www.amazon.in/-/bn/dp/B09WRKHWP7/	100		
phone		B0FHWKYR2P	https://www.amazon.in/-/bn/dp/B0FHWKYR2P/	realme 14X 5G স্মার্টফোন ডাইমেনসিটি 6300 6nm চিপ 8GB RAM 128GB ROM 6.67 Inch HD+ IP69 ওয়াটারপ্রুফ 6000mAh ব্যাটারি 45W ফাস্ট চার্জ সাপোর্ট ফিঙ্গারপ্রিন্ট GPS WiFi ব্লুটুথ গোল্ড	14885	10		https://m.media-amazon.com/images/I/612e33RDElL._AC_UY654_QL65_.jpg	INR	https://www.amazon.in/-/bn/dp/B0FHWKYR2P/	100		
phone		B0DSKNLFBG	https://www.amazon.in/-/bn/dp/B0DSKNLFBG/	"Samsung Galaxy S25 5G স্মার্টফোন Galaxy AI সহ (সিলভার শ্যাডো, 12GB RAM, 256GB স্টোরেজ), Snapdragon 8 Elite, প্রোভিসুয়াল ইঞ্জিন সহ 50 MP ক্যামেরা এবং 4000mAh ব্যাটারি"	80999	10		https://m.media-amazon.com/images/I/61D3EdXKG5L._AC_UY654_QL65_.jpg	INR	https://www.amazon.in/-/bn/dp/B0DSKNLFBG/	100		
phone		B0FG7F6C1C	https://www.amazon.in/-/bn/dp/B0FG7F6C1C/	"OPPO K13x 5G 6000mAh এবং 45W SUPERVOOC চার্জার এবং AI (সানসেট পিচ, 128 GB) (6 GB RAM)"	14399	10		https://m.media-amazon.com/images/I/51G2HmZSLJL._AC_UY654_QL65_.jpg	INR	https://www.amazon.in/-/bn/dp/B0FG7F6C1C/	100		
phone		B0F9YVG9C9	https://www.amazon.in/-/bn/dp/B0F9YVG9C9/	"Philips অল-নিউ E2103 স্লিক এবং স্টাইলিশ | কিপ্যাড মোবাইল 1.77"" স্ক্রিন সহ|1000 MAH ব্যাটারি | 2030mm স্পিকার| ওয়্যারলেস FM | ব্রাইট টর্চ |কালো"	1099	10		https://m.media-amazon.com/images/I/719ko4Tgu+L._AC_UY654_QL65_.jpg	INR	https://www.amazon.in/-/bn/dp/B0F9YVG9C9/	100		
phone		B0DR5D79DQ	https://www.amazon.in/-/bn/dp/B0DR5D79DQ/	"POCO M7 Pro 5G, ল্যাভেন্ডার ফ্রস্ট (8GB, 256GB)"	16986	10		https://m.media-amazon.com/images/I/51MI2CEBcUL._AC_UY654_QL65_.jpg	INR	https://www.amazon.in/-/bn/dp/B0DR5D79DQ/	100		
phone		B0FMRLNSFQ	https://www.amazon.in/-/bn/dp/B0FMRLNSFQ/	"Pova 7 5G (ওসিস গ্রিন, 8GB+256GB) | মাল্টি-ফাংশনাল ডেল্টা লাইট ইন্টারফেস | সেগমেন্টের সেরা AI স্মার্টফোন | 45W সহ বিগ 6000mAh ব্যাটারি | সুপার স্মুথ 144Hz 6.78"" FHD+ ডিসপ্লে | 4X4 MIMO সাপোর্ট করে"	14599	10		https://m.media-amazon.com/images/I/61-JsE1+DQL._AC_UY654_QL65_.jpg	INR	https://www.amazon.in/-/bn/dp/B0FMRLNSFQ/	100		
phone		B0FNX24L38	https://www.amazon.in/-/bn/dp/B0FNX24L38/	"Lava Bold N1 5G (রয়্যাল ব্লু, 4GB RAM, 128GB স্টোরেজ) | বড় 6.75"" HD+ নচ ডিসপ্লে | Octacore 5G প্রসেসর | 13 MP AI ক্যামেরা | 5000 mAh ব্যাটারি | IP54 রেটেড ডাস্ট এবং ওয়াটার স্প্ল্যাশ প্রুফ"	8499	10		https://m.media-amazon.com/images/I/71D93r4ATWL._AC_UY654_QL65_.jpg	INR	https://www.amazon.in/-/bn/dp/B0FNX24L38/	100		
headphones		B0BZHT8T7T	https://www.amazon.in/-/bn/dp/B0BZHT8T7T/	"boAt Rockerz 551ANC, 100HRS ব্যাটারি, হাইব্রিড ANC(~35Db), ফাস্ট চার্জ, পরিবেষ্টিত সাউন্ড মোড এবং ডুয়াল EQ মোড, Enx টেক, ব্লুটুথ হেডফোন, মাইকের সাথে ওভার ইয়ার ওয়্যারলেস হেডফোন (সেজ গ্রিন)"	1599	10		https://m.media-amazon.com/images/I/61WFLydWqpL._AC_UY654_QL65_.jpg	INR	https://www.amazon.in/-/bn/dp/B0BZHT8T7T/	100		
headphones		B07L8KV2KC	https://www.amazon.in/-/bn/dp/B07L8KV2KC/	"জেব্রনিক্স জেব-থান্ডার ওয়্যারলেস বিটি হেডফোনটি 40 মিমি ড্রাইভার, এউএক্স কানেক্টিভিটি, এফএম, বিল ফাংশন, 9 ঘন্টা*, প্লেব্যাক সময় এবং মাইক্রো এসডি কার্ড সমর্থন করে"	799	10		https://m.media-amazon.com/images/I/61i7ivBDe3L._AC_UY654_QL65_.jpg	INR	https://www.amazon.in/-/bn/dp/B07L8KV2KC/	100		
headphones		B09R24HMNW	https://www.amazon.in/-/bn/dp/B09R24HMNW/	"ZEBRONICS Zeb-Bro ইন-ইয়ার ওয়্যার্ড ইয়ারফোন মাইকের সাথে, 3.5mm অডিও জ্যাক, 10mm ড্রাইভার, ফোন/ট্যাবলেট সামঞ্জস্যপূর্ণ(নীল)"	139	10		https://m.media-amazon.com/images/I/61+5q4oGJWL._AC_UY654_QL65_.jpg	INR	https://www.amazon.in/-/bn/dp/B09R24HMNW/	100		
headphones		B0FGTZ19JS	https://www.amazon.in/-/bn/dp/B0FGTZ19JS/	"pTron Studio Evo 70hrs Playtime Wireless Over Ear Headphones with HD Mic, Low-Latency Game/Movie/Music Modes, Punchy Bass, BT5.3, Dual Device Pairing, Voice Assistant & Type-C Fast Charging (Beige)"	799	10		https://m.media-amazon.com/images/I/51+Zl86jLkL._AC_UY654_QL65_.jpg	INR	https://www.amazon.in/-/bn/dp/B0FGTZ19JS/	100		
headphones		B0DGTSRX3R	https://www.amazon.in/-/bn/dp/B0DGTSRX3R/	"boAt Rockerz 480, RGB LEDs,6 লাইট মোড, 40mm ড্রাইভার, বিস্ট মোড, 60H ব্যাটারি, ENx Tech, অ্যাপ সাপোর্টের মাধ্যমে স্ট্রিম বিজ্ঞাপন ফ্রি সঙ্গীত, ব্লুটুথ হেডফোন, মাইকের সাথে ওয়্যারলেস ওভার ইয়ার হেডফোন"	1799	10		https://m.media-amazon.com/images/I/711l4y8aNlL._AC_UY654_QL65_.jpg	INR	https://www.amazon.in/-/bn/dp/B0DGTSRX3R/	100		
headphones		B0BS1RT9S2	https://www.amazon.in/-/bn/dp/B0BS1RT9S2/	"Sony WH-CH520 ওয়্যারলেস ব্লুটুথ হেডফোন অন ইয়ার মাইক সহ, 50 ঘন্টা পর্যন্ত ব্যাটারি, কুইক চার্জ, DSEE আপস্কেল, মাল্টিপয়েন্ট সংযোগ, ভয়েস অ্যাসিস্ট্যান্ট, কাস্টমাইজড EQ-ব্লু"	3989	10		https://m.media-amazon.com/images/I/41JACWT-wWL._AC_UY654_QL65_.jpg	INR	https://www.amazon.in/-/bn/dp/B0BS1RT9S2/	100		
headphones		B0BZHRB9J1	https://www.amazon.in/-/bn/dp/B0BZHRB9J1/	"boAt Rockerz 551ANC ব্লুটুথ হাইব্রিড অ্যাক্টিভ নয়েজ ক্যান্সেলেশন ওভার ইয়ার হেডফোন 100 ঘণ্টা পর্যন্ত প্লেটাইম, ASAP চার্জ, পরিবেষ্টিত সাউন্ড মোড এবং ডুয়াল EQ মোড, Enx প্রযুক্তি (স্টেলার ব্ল্যাক)"	1599	10		https://m.media-amazon.com/images/I/61BrerJ+yML._AC_UY654_QL65_.jpg	INR	https://www.amazon.in/-/bn/dp/B0BZHRB9J1/	100		
headphones		B0FC2Y8XYF	https://www.amazon.in/-/bn/dp/B0FC2Y8XYF/	"boAt 2025 Launch Rockerz 411, 40Ms লো লেটেন্সি, 40Hrs ব্যাটারি, 40Mm ড্রাইভার, ENx Tech, অ্যাপ সাপোর্টের মাধ্যমে স্ট্রিম বিজ্ঞাপন মুক্ত সঙ্গীত, ব্লুটুথ হেডফোন, মাইকের সাথে ওয়্যারলেস ওভার ইয়ার হেডফোন"	1199	10		https://m.media-amazon.com/images/I/71QdB7hDCAL._AC_UY654_QL65_.jpg	INR	https://www.amazon.in/-/bn/dp/B0FC2Y8XYF/	100		
headphones		B0B4G44RFS	https://www.amazon.in/-/bn/dp/B0B4G44RFS/	"Zebronics Zeb-Storm অন ইয়ার ওয়্যার্ড হেডফোন 3.5mm জ্যাক সহ, কলিংয়ের জন্য অন্তর্নির্মিত মাইক্রোফোন, 1.5 মিটার কেবল, নরম কানের কুশন, সামঞ্জস্যযোগ্য হেডব্যান্ড, ভাঁজযোগ্য কানের কাপ এবং হালকা ওজনের"	499	10		https://m.media-amazon.com/images/I/61FrvQMXxJL._AC_UY654_QL65_.jpg	INR	https://www.amazon.in/-/bn/dp/B0B4G44RFS/	100		
headphones		B071Z8M4KX	https://www.amazon.in/-/bn/dp/B071Z8M4KX/	মাইক সহ boAt Bassheads 100 ইয়ার ওয়্যারড ইয়ারফোন	349	10		https://m.media-amazon.com/images/I/513ugd16C6L._AC_UY654_QL65_.jpg	INR	https://www.amazon.in/-/bn/dp/B071Z8M4KX/	100		
headphones		B0B1PXM75C	https://www.amazon.in/-/bn/dp/B0B1PXM75C/	"50 ঘন্টা প্লেটাইম, কম লেটেন্সি (40ms পর্যন্ত), 4 টি প্লে মোড, ডুয়াল পেয়ারিং, BT v5.3 (সেরিন ব্লু) সহ নতুন লঞ্চ হওয়া নয়েজ টু অন-ইয়ার হেডফোন"	1499	10		https://m.media-amazon.com/images/I/517lSvEVVsL._AC_UY654_QL65_.jpg	INR	https://www.amazon.in/-/bn/dp/B0B1PXM75C/	100		
headphones		B08QTYYNDN	https://www.amazon.in/-/bn/dp/B08QTYYNDN/	"JBL Tune 510BT, মাইকের সাথে অন-ইয়ার ওয়্যারলেস হেডফোন, 40 ঘন্টা অবধি প্লেটাইম, খাঁটি বেস, দ্রুত চার্জিং, ডুয়াল পেয়ারিং, ব্লুটুথ 5.0 এবং মোবাইল ফোনের জন্য ভয়েস অ্যাসিস্ট্যান্ট সাপোর্ট (কালো)"	2499	10		https://m.media-amazon.com/images/I/61kFL7ywsZS._AC_UY654_QL65_.jpg	INR	https://www.amazon.in/-/bn/dp/B08QTYYNDN/	100		
headphones		B0CWVX1GNX	https://www.amazon.in/-/bn/dp/B0CWVX1GNX/	"Sony ULT Wear WH-ULT900N নয়েজ ক্যান্সেলেশন ওয়্যারলেস ব্লুটুথ ওভার ইয়ার হেডফোনগুলি ম্যাসিভ বেস সহ, 50 ঘন্টা পর্যন্ত ব্যাটারি-ব্ল্যাক"	14557	10		https://m.media-amazon.com/images/I/610DB8Cwm7L._AC_UY654_QL65_.jpg	INR	https://www.amazon.in/-/bn/dp/B0CWVX1GNX/	100		
headphones		B00KGZZ824	https://www.amazon.in/-/bn/dp/B00KGZZ824/	Sonyহেডফোন MDR	868	10		https://m.media-amazon.com/images/I/41BoLKMYjnL._AC_UY654_QL65_.jpg	INR	https://www.amazon.in/-/bn/dp/B00KGZZ824/	100		
headphones		B0863TXGM3	https://www.amazon.in/-/bn/dp/B0863TXGM3/	"Sony WH-1000XM4 ইন্ডাস্ট্রি লিড করছে ওয়্যারলেস নয়েজ ক্যান্সেলিং হেডফোনগুলি, ব্লুটুথ হেডসেট এর সাথে মাইক ফোন কলের জন্য, 30 ঘন্টা ব্যাটারি লাইফ, দ্রুত চার্জ, টাচ কন্ট্রোল এবং অ্যালেক্সা ভয়েস কন্ট্রোল"	22990	10		https://m.media-amazon.com/images/I/61oqO1AMbdL._AC_UY654_QL65_.jpg	INR	https://www.amazon.in/-/bn/dp/B0863TXGM3/	100		
headphones		B0C664NHV6	https://www.amazon.in/-/bn/dp/B0C664NHV6/	"JBL Tune 770NC ওয়্যারলেস ওভার ইয়ার ANC হেডফোন মাইক সহ, 70 ঘন্টা পর্যন্ত ব্যাটারি, স্পিড চার্জ: 5 মিনিটের চার্জ 3H পর্যন্ত প্লেব্যাক দেয়, কাস্টমাইজড EQ, Google ফাস্ট পেয়ার, ডুয়াল পেয়ারিং, BT 5.3"	5499	10		https://m.media-amazon.com/images/I/71PdaCws72L._AC_UY654_QL65_.jpg	INR	https://www.amazon.in/-/bn/dp/B0C664NHV6/	100		
headphones		B08CHPGTSF	https://www.amazon.in/-/bn/dp/B08CHPGTSF/	"Zebronics PC কম্পিউটার/ল্যাপটপের জন্য মাইক, ডুয়াল 3.5mm সংযোজক, সামঞ্জস্যযোগ্য হেডব্যান্ড এবং মাইক সহ Zeb-200HM হেডফোন,"	449	10		https://m.media-amazon.com/images/I/7179kqSfnAL._AC_UY654_QL65_.jpg	INR	https://www.amazon.in/-/bn/dp/B08CHPGTSF/	100		
headphones		B09XS7JWHH	https://www.amazon.in/-/bn/dp/B09XS7JWHH/	"Sony WH-1000XM5 বেস্ট অ্যাক্টিভ নয়েজ ক্যান্সেলিং ওয়্যারলেস ব্লুটুথ ওভার ইয়ার হেডফোন সাথে ক্লিয়ার কলিং, ব্যাটারি লাইফ 30 ঘন্টা -ব্ল্যাক"	29193	10		https://m.media-amazon.com/images/I/51aXvjzcukL._AC_UY654_QL65_.jpg	INR	https://www.amazon.in/-/bn/dp/B09XS7JWHH/	100		
headphones		B0BZPK3XFQ	https://www.amazon.in/-/bn/dp/B0BZPK3XFQ/	"Sony WH-CH520 ওয়্যারলেস ব্লুটুথ হেডফোন মাইক সহ, 50 ঘন্টা পর্যন্ত ব্যাটারি, দ্রুত চার্জ, DSEE আপস্কেল, মাল্টিপয়েন্ট সংযোগ, ভয়েস অ্যাসিস্ট্যান্ট, কাস্টমাইজড EQ-বেইজ"	3849	10		https://m.media-amazon.com/images/I/61C66qTqnwL._AC_UY654_QL65_.jpg	INR	https://www.amazon.in/-/bn/dp/B0BZPK3XFQ/	100		
headphones		B0B5RMKMJL	https://www.amazon.in/-/bn/dp/B0B5RMKMJL/	"Zebronics Jet PRO প্রিমিয়াম ওয়্যার্ড গেমিং অন ইয়ার হেডফোন LED সহ হেডব্যান্ড + ইয়ারকাপের জন্য, 40mm নিওডিয়ামিয়াম ড্রাইভার, 2 মিটার ব্রেইডেড কেবল, মাইক সহ, সাসপেনশন ডিজাইন, 3.5mm + USB কানেক্টর"	899	10		https://m.media-amazon.com/images/I/71VR6c3j2bL._AC_UY654_QL65_.jpg	INR	https://www.amazon.in/-/bn/dp/B0B5RMKMJL/	100		
headphones		B0BS1QCFHX	https://www.amazon.in/-/bn/dp/B0BS1QCFHX/	"Sony WH-CH720N অ্যাক্টিভ নয়েজ ক্যান্সেলেশন ওয়্যারলেস ব্লুটুথ ওভার ইয়ার হেডফোন, মাইক সহ, অ্যাডাপটিভ সাউন্ড কন্ট্রোল, কুইক চার্জ, 35 ঘন্টা পর্যন্ত ব্যাটারি, কাস্টমাইজড EQ- কালো"	8449	10		https://m.media-amazon.com/images/I/51rpbVmi9XL._AC_UY654_QL65_.jpg	INR	https://www.amazon.in/-/bn/dp/B0BS1QCFHX/	100		
headphones		B0G599TLD9	https://www.amazon.in/-/bn/dp/B0G599TLD9/	"Portronics Muffs M6 Over Ear Wireless Bluetooth Headphone with Upto 40 Hours Playtime, Dual Pairing, 40mm Driver, HD Mic, Bluetooth 5.4V, Foldable Design, Type C Fast Charging (Biege)"	1149	10		https://m.media-amazon.com/images/I/61ZMTLmF4ZL._AC_UY654_QL65_.jpg	INR	https://www.amazon.in/-/bn/dp/B0G599TLD9/	100		
headphones		B0CY1PL36Q	https://www.amazon.in/-/bn/dp/B0CY1PL36Q/	"Noise Airwave Max 4 ওয়্যারলেস ওভার ইয়ার হেডফোন 70H প্লেটাইম, ENC, 40mm ড্রাইভার, লো লেটেন্সি (40ms পর্যন্ত), ডুয়াল পেয়ারিং, BT v5.4 (শান্ত বেইজ)"	2499	10		https://m.media-amazon.com/images/I/614Hd3JaGOL._AC_UY654_QL65_.jpg	INR	https://www.amazon.in/-/bn/dp/B0CY1PL36Q/	100		
headphones		B01DEWVZ2C	https://www.amazon.in/-/bn/dp/B01DEWVZ2C/	"JBL C100SI তারযুক্ত ইন-ইয়ার হেডফোন মাইক সহ, খাঁটি বেস সাউন্ড, ওয়ান বোতাম মাল্টি-ফাংশন রিমোট, প্রিমিয়াম মেটালিক ফিনিশ, আরামদায়ক ফিটের জন্য কোণযুক্ত বাডস (কালো)"	599	10		https://m.media-amazon.com/images/I/51Q8DUDT2eL._AC_UY654_QL65_.jpg	INR	https://www.amazon.in/-/bn/dp/B01DEWVZ2C/	100		
headphones		B0FNNC3FKY	https://www.amazon.in/-/bn/dp/B0FNNC3FKY/	"GOBOULT Fluid X হেডফোন ব্লুটুথ ওয়্যারলেস সাথে 60H প্লেটাইম, 40mm ড্রাইভার, Zen ENC মাইক, টাইপ-C চার্জিং, কমব্যাট গেমিং, BTv 5.4, মাইক সহ ওয়্যারলেস হেডফোন (সাদা)"		10		https://m.media-amazon.com/images/I/615ARblI-qL._AC_UY654_QL65_.jpg	INR	https://www.amazon.in/-/bn/dp/B0FNNC3FKY/	100		
headphones		B0FG2QT7H2	https://www.amazon.in/-/bn/dp/B0FG2QT7H2/	"boAt Rockerz 512 ANC,(~40dB) হাইব্রিড ANC, 80H ব্যাটারি, 40mm ড্রাইভার, 40ms লো লেটেন্সি, ENx Tech,অ্যাপ সাপোর্টের মাধ্যমে বিজ্ঞাপন মুক্ত সঙ্গীত স্ট্রিম করুন, ব্লুটুথ হেডফোন, মাইকের সাথে ওয়্যারলেস"	2799	10		https://m.media-amazon.com/images/I/61qdD0zSk8L._AC_UY654_QL65_.jpg	INR	https://www.amazon.in/-/bn/dp/B0FG2QT7H2/	100		
headphones		B0DDHM6D3L	https://www.amazon.in/-/bn/dp/B0DDHM6D3L/	"Portronics Conch Theta C ইন ইয়ার টাইপ C ওয়্যার্ড ইয়ারফোন ইন লাইন HD মাইক, পাওয়ারফুল অডিও, 14.2mm ড্রাইভার, ইউনিক ইয়ারবাডস ডিজাইন, TPE অ্যান্টি ট্যাঙ্গেল ওয়্যার, লাইন কন্ট্রোলে, ওয়াইড"	279	10		https://m.media-amazon.com/images/I/51GGwjwSr0L._AC_UY654_QL65_.jpg	INR	https://www.amazon.in/-/bn/dp/B0DDHM6D3L/	100		
headphones		B074ZF7PVZ	https://www.amazon.in/-/bn/dp/B074ZF7PVZ/	মাইকসহ তারযুক্ত হেডফোন Boat BassHeads 900	899	10		https://m.media-amazon.com/images/I/61XBkWmmQeL._AC_UY654_QL65_.jpg	INR	https://www.amazon.in/-/bn/dp/B074ZF7PVZ/	100		
