type,disc,id,competitor_price,product_name,our_price,inventory,demand_score,img_url,timestamp,url,,,
smart watches,1,B0D9629NJQ,1499,"Fastrack Limitless ব্লুটুথ কলিং স্মার্টওয়াচ, জেট ব্ল্যাক, 46.48 মিমি, সীমাহীন গ্লাইড",1499,10,8,https://m.media-amazon.com/images/I/71rNSvzQGlL._AC_UY654_QL65_.jpg,INR,https://www.amazon.in/-/bn/dp/B0D9629NJQ/,100,,
smart watches,1,B0CMF25TKG,1199,"Fire‑Boltt Rise Smart Watch 1.85″ HD ডিসপ্লে ব্লুটুথ কলিং, AI ভয়েস অ্যাসিস্ট্যান্ট, রোটেটিং ক্রাউন, SpO2 এবং হার্ট রেট মনিটর, 120+ স্পোর্টস মোড, IP67 ওয়াটারপ্রুফ স্মার্ট ওয়াচ পুরুষ ও মহিলাদের জন্য",1199,10,9,https://m.media-amazon.com/images/I/61IGSSfF-JL._AC_UY654_QL65_.jpg,INR,https://www.amazon.in/-/bn/dp/B0CMF25TKG/,100,,
smart watches,1,B0CQLZ7W1N,999,"GOBOULT Drift+ স্মার্ট ওয়াচ 1.85''HD স্ক্রিন, ব্লুটুথ কলিং, IP68, 500 Nits ব্রাইটনেস, 150+ ওয়াচফেস, AI ভয়েস অ্যাসিস্ট্যান্ট, SpO2 মনিটরিং, 100+ স্পোর্টস মোড স্মার্টওয়াচ (জেট ব্ল্যাক)",999,10,10,https://m.media-amazon.com/images/I/71Ar4cKZKYL._AC_UY654_QL65_.jpg,INR,https://www.amazon.in/-/bn/dp/B0CQLZ7W1N/,100,,
smart watches,1,B0CQRQK8L8,1199,"Noise ColorFit Pulse 3 সাথে 1.96"" বৃহত্তম ডিসপ্লে ব্লুটুথ কলিং স্মার্ট ওয়াচ, প্রিমিয়াম বিল্ড, অটো স্পোর্ট সনাক্তকরণ এবং পুরুষ ও মহিলাদের জন্য 170+ Watch Faces স্মার্টওয়াচ - মিডনাইট ব্ল্যাক",1199,10,11,https://m.media-amazon.com/images/I/61DEUVd9PwL._AC_UY654_QL65_.jpg,INR,https://www.amazon.in/-/bn/dp/B0CQRQK8L8/,100,,
smart watches,1,B0B6BPTFT5,1199,"Noise Pulse 2 Max অ্যাডভান্সড ব্লুটুথ কলিং স্মার্ট ওয়াচ 1.85'' TFT এবং 550 Nits ব্রাইটনেস, স্মার্ট DND, 10 দিনের ব্যাটারি, 100 স্পোর্টস মোড, উৎপাদনশীলতা স্যুট এবং নয়েজ হেলথ স্যুট - (ডিপ ওয়াইন)",1199,10,12,https://m.media-amazon.com/images/I/610BF3kqBZL._AC_UY654_QL65_.jpg,INR,https://www.amazon.in/-/bn/dp/B0B6BPTFT5/,100,,
smart watches,1,B0BRKZG8GH,1199,"Fire-Boltt Phoenix Pro রাউন্ড স্মার্ট ওয়াচ 1.39″ HD ডিসপ্লে ব্লুটুথ কলিং, AI ভয়েস অ্যাসিস্ট্যান্ট, SpO2 এবং হার্ট রেট মনিটর, 120+ স্পোর্টস মোড, IP67 ওয়াটারপ্রুফ স্মার্টওয়াচ পুরুষ ও মহিলাদের জন্য",1199,10,13,https://m.media-amazon.com/images/I/61643EQDHqL._AC_UY654_QL65_.jpg,INR,https://www.amazon.in/-/bn/dp/B0BRKZG8GH/,100,,
smart watches,1,B0DYJKTHYF,7999,"Amazfit Bip 6 স্মার্ট ওয়াচ 46mm, 14 দিনের ব্যাটারি, 1.97"" AMOLED ডিসপ্লে, GPS এবং ফ্রি ম্যাপস, AI, ব্লুটুথ কল এবং টেক্সট, স্বাস্থ্য, ফিটনেস এবং স্লিপ ট্র্যাকার, 140+ ওয়ার্কআউট মোড, 5 ATM",7999,10,14,https://m.media-amazon.com/images/I/61UvVTN0IEL._AC_UY654_QL65_.jpg,INR,https://www.amazon.in/-/bn/dp/B0DYJKTHYF/,100,,
smart watches,1,B0D26YL3VP,398,"Bouncefit M I D116 ফিটনেস ব্যান্ড স্মার্ট ওয়াচ পুরুষ, মহিলা, বালক, বালিকা, বাচ্চাদের জন্য - একক টাচ ইন্টারফেস, জল প্রতিরোধী, ওয়ার্কআউট মোড, দ্রুত চার্জ স্পোর্টস স্মার্টওয়াচ - কালো",398,10,15,https://m.media-amazon.com/images/I/61Q2aOIpXZL._AC_UY654_QL65_.jpg,INR,https://www.amazon.in/-/bn/dp/B0D26YL3VP/,100,,
smart watches,1,B0BW4BFBD5,1069,"Noise Quad Call 1.81"" ডিসপ্লে, ব্লুটুথ কলিং স্মার্ট ওয়াচ, AI ভয়েস অ্যাসিস্ট্যান্স, 160+ঘন্টা ব্যাটারি লাইফ, মেটালিক বিল্ড, ইন-বিল্ট গেমস, 100 স্পোর্টস মোড, 100+ ওয়াচ ফেসেস (রোজ পিঙ্ক)",1069,10,16,https://m.media-amazon.com/images/I/61XESKwObcL._AC_UY654_QL65_.jpg,INR,https://www.amazon.in/-/bn/dp/B0BW4BFBD5/,100,,
smart watches,1,B0BN1ZG1QZ,2999,"NoiseFit Halo 1.43"" AMOLED ডিসপ্লে, ব্লুটুথ কলিং রাউন্ড ডায়াল স্মার্ট ওয়াচ, প্রিমিয়াম মেটালিক বিল্ড, অলওয়েজ অন ডিসপ্লে, স্মার্ট জেসচার কন্ট্রোল, 100 স্পোর্টস মোড (ভিনটেজ ব্রাউন)",2999,10,17,https://m.media-amazon.com/images/I/71aTghUQfqL._AC_UY654_QL65_.jpg,INR,https://www.amazon.in/-/bn/dp/B0BN1ZG1QZ/,100,,
smart watches,1,B0DFYL4635,1499,"Boat Lunar Discovery w/ 1.39"" (3.5 cm) HD ডিসপ্লে, টার্ন-বাই-টার্ন নেভিগেশন, DIY ওয়াচ ফেস স্টুডিও, ব্লুটুথ কলিং, ইমার্জেন্সি SOS, QR ট্রে, পুরুষ ও মহিলাদের জন্য স্মার্ট ওয়াচ (অ্যাক্টিভ ব্ল্যাক)",1499,10,18,https://m.media-amazon.com/images/I/71Iit7U1S+L._AC_UY654_QL65_.jpg,INR,https://www.amazon.in/-/bn/dp/B0DFYL4635/,100,,
smart watches,1,B0D4ZFTLPX,1199,"Noise ColorFit Pulse 3 সাথে 1.96"" বৃহত্তম ডিসপ্লে ব্লুটুথ কলিং স্মার্ট ওয়াচ, প্রিমিয়াম বিল্ড, অটো স্পোর্ট সনাক্তকরণ এবং 170+ ওয়াচ ফেসেস স্মার্টওয়াচ পুরুষ ও মহিলাদের জন্য (মোচা ব্রাউন)",1199,10,19,https://m.media-amazon.com/images/I/61aWmr2upoL._AC_UY654_QL65_.jpg,INR,https://www.amazon.in/-/bn/dp/B0D4ZFTLPX/,100,,
smart watches,1,B0DKBZYXZY,1099,"Fire-Boltt Ninja Call Pro Max Ultra Smart Watch 2.01″ ব্লুটুথ কলিং, AI ভয়েস অ্যাসিস্ট্যান্ট, SpO2 এবং হার্ট রেট মনিটর, 120+ স্পোর্টস মোড, IP67 ওয়াটারপ্রুফ মেটাল স্মার্ট ওয়াচ পুরুষ ও মহিলাদের জন্য",1099,10,20,https://m.media-amazon.com/images/I/71e3LEJuG4L._AC_UY654_QL65_.jpg,INR,https://www.amazon.in/-/bn/dp/B0DKBZYXZY/,100,,
smart watches,1,B0FP2H4K27,1999,"Fire-Boltt Axiom Round Smart Watch 1.43″ সুপার AMOLED ডিসপ্লে সাথে সর্বদা-অন মোড, ব্লুটুথ কলিং, রোটেটিং ক্রাউন, SPO₂ এবং হার্ট রেট মনিটর, IP67 ওয়াটারপ্রুফ সিলিকন স্মার্টওয়াচ পুরুষদের জন্য - সাদা",1999,10,21,https://m.media-amazon.com/images/I/71gdP7CfeiL._AC_UY654_QL65_.jpg,INR,https://www.amazon.in/-/bn/dp/B0FP2H4K27/,100,,
smart watches,1,B0F8JF1R8X,2499,"Noise Twist 2 স্মার্ট ওয়াচ সাথে 1.43"" AMOLED স্ক্রিন, AI সার্চ অ্যান্ড ভয়েস অ্যাসিস্ট্যান্ট, ব্লুটুথ কলিং, স্টেইনলেস স্টিল ব্যাক, 7-দিনের ব্যাটারি, 100+ ওয়াচ ফেস, হেলথ স্যুট, IP68 (জেট ব্ল্যাক)",2499,10,22,https://m.media-amazon.com/images/I/61r0qYy7jZL._AC_UY654_QL65_.jpg,INR,https://www.amazon.in/-/bn/dp/B0F8JF1R8X/,100,,
smart watches,1,B0DM5JDVCC,1299,"GOBOULT ট্রেইল স্মার্ট ওয়াচ 2.01'' 3D কার্ভড HD ডিসপ্লে, BT কলিং, ওয়ার্কিং ক্রাউন, 190+ওয়াচফেস, 500 Nits ব্রাইটনেস, AI ভয়েস অ্যাসিস্ট্যান্ট, SpO2 মনিটরিং, 120+ স্পোর্টস (মেটাল ব্ল্যাক)",1299,10,23,https://m.media-amazon.com/images/I/71+Em5KJCcL._AC_UY654_QL65_.jpg,INR,https://www.amazon.in/-/bn/dp/B0DM5JDVCC/,100,,
smart watches,1,B0D6GK2871,2499,"Noise Pulse 4 Max Smart Watch with AI Create (ভারতের 1st Ever with Unlimited Watch Face সহ), AI অনুসন্ধান, 1.96"" AMOLED ডিসপ্লে, ফাংশনাল ক্রাউন, প্রিমিয়াম মেটালিক ফিনিশ, হেলথ স্যুট (জেট ব্ল্যাক)",2499,10,24,https://m.media-amazon.com/images/I/61Iw0g8zYYL._AC_UY654_QL65_.jpg,INR,https://www.amazon.in/-/bn/dp/B0D6GK2871/,100,,
smart watches,1,B0CVQDZWVX,14999,"OnePlus Watch 2 সাথে Wear OS 4, Snapdragon W5 চিপসেট, 100 ঘন্টা পর্যন্ত ব্যাটারি লাইফ, 1.43'' AMOLED ডিসপ্লে, স্টেইনলেস স্টিল এবং স্যাফায়ার ক্রিস্টাল বিল্ড, ডুয়াল ফ্রিকোয়েন্সি GPS, 5 ATM, IP68 এবং",14999,10,25,https://m.media-amazon.com/images/I/718YrDupr0L._AC_UY654_QL65_.jpg,INR,https://www.amazon.in/-/bn/dp/B0CVQDZWVX/,100,,
smart watches,1,B0F5HTCGRG,1999,"Fastrack UltraVU HD ডিসপ্লে ব্লুটুথ কলিং স্মার্টওয়াচ, গ্রে::সাদা::কালো, সীমাহীন বীরত্ব",1999,10,26,https://m.media-amazon.com/images/I/71Wh4vhuEzL._AC_UY654_QL65_.jpg,INR,https://www.amazon.in/-/bn/dp/B0F5HTCGRG/,100,,
smart watches,1,B0D2KGZZ4R,1799,"Fire-Boltt Brillia Smart Watch 2.02″ সুপার AMOLED ডিসপ্লে ব্লুটুথ কলিং, ভয়েস অ্যাসিস্ট্যান্ট, SpO2 এবং হার্ট রেট মনিটর, 120+ স্পোর্টস মোড, IP67 ওয়াটারপ্রুফ স্মার্টওয়াচ পুরুষ ও মহিলাদের জন্য",1799,10,27,https://m.media-amazon.com/images/I/71XVWk+fcVL._AC_UY654_QL65_.jpg,INR,https://www.amazon.in/-/bn/dp/B0D2KGZZ4R/,100,,
smart watches,1,B0CFYNB5NF,2999,"Noise Colorfit Pro 5 স্মার্ট ওয়াচ 1.85"" AMOLED ডিসপ্লে, BT কলিং, নতুন DIY ওয়াচ ফেস, স্মার্ট ডক ডিজাইন, জরুরী SOS প্রযুক্তি, ইমোজি সাপোর্ট, 5X দ্রুত ডেটা স্থানান্তর, Instacharge?? (স্টারলাইট গোল্ড)",2999,10,28,https://m.media-amazon.com/images/I/618sHIqH+VL._AC_UY654_QL65_.jpg,INR,https://www.amazon.in/-/bn/dp/B0CFYNB5NF/,100,,
smart watches,1,B0DKFT7RCN,18790,"Samsung Galaxy Watch 7 (44mm, Green, BT+LTE) 3nm প্রসেসর সহ | ডুয়াল GPS | স্যাফায়ার গ্লাস এবং আর্মার অ্যালুমিনিয়াম | 5ATM এবং IP68 | HR, SpO2, BP ও ECG মনিটর",18790,10,29,https://m.media-amazon.com/images/I/71QUv8DcRBL._AC_UY654_QL65_.jpg,INR,https://www.amazon.in/-/bn/dp/B0DKFT7RCN/,100,,
smart watches,1,B0FLF5KFQ8,1399,"Boat Wave Call 3 স্মার্টওয়াচ 1.83"" HD ডিসপ্লে অ্যানিমেটেড ওয়াচ ফেস সহ; BT কলিং, ফাংশনাল ক্রাউন, একাধিক স্পোর্টস মোড, IP68, HR, SpO2 মনিটর, পুরুষ ও মহিলাদের জন্য স্মার্ট ঘড়ি (টিম্বার ব্রাউন)",1399,10,30,https://m.media-amazon.com/images/I/71HwtfJ3c6L._AC_UY654_QL65_.jpg,INR,https://www.amazon.in/-/bn/dp/B0FLF5KFQ8/,100,,
smart watches,1,B0F8GP4FL1,3499,"CrossBeats Everest 2.0 2025 স্মার্ট ওয়াচ পুরুষদের জন্য 1.43"" ট্রু AMOLED, সর্বদা চালু ডিসপ্লে ব্লুটুথ কলিং রাগড আউটডোর ফ্ল্যাশ লাইট সহ 15 দিন পর্যন্ত ব্যাটারি লাইফ স্মার্টওয়াচ 100+ স্পোর্টস মোড",3499,10,31,https://m.media-amazon.com/images/I/71S8pzCYTlL._AC_UY654_QL65_.jpg,INR,https://www.amazon.in/-/bn/dp/B0F8GP4FL1/,100,,
smart watches,1,B0CTCLBST5,4379,"Samsung Galaxy Fit3 হালকা এবং স্লিক ফিটনেস ব্যান্ড, 13 দিনের ব্যাটারি, 100+ অনুশীলন এবং স্লিপ ট্র্যাকিং, ডার্ক গ্রে (কালো)",4379,10,32,https://m.media-amazon.com/images/I/5163cMsZUsL._AC_UY654_QL65_.jpg,INR,https://www.amazon.in/-/bn/dp/B0CTCLBST5/,100,,
smart watches,1,B0F8GP4FL1,3499,"CrossBeats Everest 2.0 2025 স্মার্ট ওয়াচ পুরুষদের জন্য 1.43"" ট্রু AMOLED, সর্বদা চালু ডিসপ্লে ব্লুটুথ কলিং রাগড আউটডোর ফ্ল্যাশ লাইট সহ 15 দিন পর্যন্ত ব্যাটারি লাইফ স্মার্টওয়াচ 100+ স্পোর্টস মোড",3499,10,33,https://m.media-amazon.com/images/I/71S8pzCYTlL._AC_UY654_QL65_.jpg,INR,https://www.amazon.in/-/bn/dp/B0F8GP4FL1/,100,,
smart watches,1,B0FLF5KFQ8,1399,"Boat Wave Call 3 স্মার্টওয়াচ 1.83"" HD ডিসপ্লে অ্যানিমেটেড ওয়াচ ফেস সহ; BT কলিং, ফাংশনাল ক্রাউন, একাধিক স্পোর্টস মোড, IP68, HR, SpO2 মনিটর, পুরুষ ও মহিলাদের জন্য স্মার্ট ঘড়ি (টিম্বার ব্রাউন)",1399,10,34,https://m.media-amazon.com/images/I/71HwtfJ3c6L._AC_UY654_QL65_.jpg,INR,https://www.amazon.in/-/bn/dp/B0FLF5KFQ8/,100,,
smart watches,1,B0BY2QJJ8J,1199,"Fire-Boltt টক রাউন্ড স্মার্ট ওয়াচ 1.39″ TFT ডিসপ্লে ব্লুটুথ কলিং, ডুয়াল বোতাম, ভয়েস অ্যাসিস্ট্যান্স, SPO₂ এবং হার্ট রেট মনিটর, 120+ স্পোর্টস মোড, পুরুষ ও মহিলাদের জন্য স্মার্টওয়াচ সহ - কালো",1199,10,35,https://m.media-amazon.com/images/I/61Vk-Npjs-L._AC_UY654_QL65_.jpg,INR,https://www.amazon.in/-/bn/dp/B0BY2QJJ8J/,100,,
smart watches,1,B0D963J6GN,1499,"Fastrack Limitless ব্লুটুথ কলিং স্মার্টওয়াচ, নেভি ব্লু, 46.48 মিমি, সীমাহীন গ্লাইড",1499,10,36,https://m.media-amazon.com/images/I/81Dk8SDkmRL._AC_UY654_QL65_.jpg,INR,https://www.amazon.in/-/bn/dp/B0D963J6GN/,100,,
smart watches,1,B0DGJ61XV7,27900,"Apple Watch SE (2nd Gen, 2023) [GPS 44mm] ইঙ্ক স্পোর্ট লুপ সহ মিডনাইট অ্যালুমিনিয়াম কেস সহ স্মার্টওয়াচ। ফিটনেস এবং স্লিপ ট্র্যাকার, ক্র্যাশ ডিটেকশন, হার্ট রেট মনিটর, রেটিনা ডিসপ্লে",27900,10,37,https://m.media-amazon.com/images/I/81qLjHhA8oL._AC_UY654_QL65_.jpg,INR,https://www.amazon.in/-/bn/dp/B0DGJ61XV7/,100,,
smart watches,1,B0DNW6WRDZ,399,"MARVIK স্মার্ট ওয়াচ বাচ্চা, পুরুষ, ছেলে, বালিকা এবং মহিলাদের জন্য, ID116 Plus 2024, Android এবং iOS ফোনের জন্য সর্বশেষতম, দৈনিক অ্যাক্টিভিটি ট্র্যাকারের সাথে IP68 জলরোধী, হার্ট রেট সেন্সর, স্লিপ",399,10,38,https://m.media-amazon.com/images/I/61Famx7xQwL._AC_UY654_QL65_.jpg,INR,https://www.amazon.in/-/bn/dp/B0DNW6WRDZ/,100,,
smart watches,1,B0CF1NTL6M,1599,"boAt Lunar Vista w/Large 1.52inch (3.8 cm) HD সর্বদা অন ডিসপ্লে,550 Nits ব্রাইটনেস, ফাংশনাল ক্রাউন,100+ স্পোর্টস মোড, হার্ট রেট এবং Sp02 মনিটরিং, পুরুষ ও মহিলাদের জন্য ফিটনেস স্মার্ট ওয়াচ (কালো)",1599,10,39,https://m.media-amazon.com/images/I/71qXnQw5xyL._AC_UY654_QL65_.jpg,INR,https://www.amazon.in/-/bn/dp/B0CF1NTL6M/,100,,
smart watches,1,B0DKFT2J9C,24999,"Samsung Galaxy Watch 7 (44mm, Silver, BT+LTE) 3nm প্রসেসর সহ | ডুয়াল GPS | স্যাফায়ার গ্লাস এবং আর্মার অ্যালুমিনিয়াম | 5ATM এবং IP68 | HR, SpO2, BP ও ECG মনিটর",24999,10,40,https://m.media-amazon.com/images/I/71d7quY-KxL._AC_UY654_QL65_.jpg,INR,https://www.amazon.in/-/bn/dp/B0DKFT2J9C/,100,,
smart watches,1,B0G3Q2MJQL,2999,"GOBOULT সদ্য চালু হওয়া আলোরা স্মার্ট ওয়াচ 1.19'' AMOLED ডিসপ্লে, BT কলিং, রোটেটিং বেজেল, 150+ ওয়াচফেস, 800 Nits ব্রাইটনেস, AI ভয়েস অ্যাসিস্ট্যান্ট, SpO2 মনিটরিং, 120+ স্পোর্টস মোড (রেড ওয়াইন)",2999,10,41,https://m.media-amazon.com/images/I/81enZN-UewL._AC_UY654_QL65_.jpg,INR,https://www.amazon.in/-/bn/dp/B0G3Q2MJQL/,100,,
smart watches,1,B0C1N1KXHH,1999,"Fastrack Limitless ব্লুটুথ কলিং স্মার্টওয়াচ, রয়্যাল ব্লু, 1.95"", সীমাহীন FS1",1999,10,42,https://m.media-amazon.com/images/I/71wRh+9yqrL._AC_UY654_QL65_.jpg,INR,https://www.amazon.in/-/bn/dp/B0C1N1KXHH/,100,,
smart watches,1,B0CVWZNBYW,1144,"boAt Wave Sigma 3 w/Turn-by-Turn ন্যাভিগেশন, 2.01"" HD ডিসপ্লে, ব্লুটুথ কলিং, Crest+ OS, QR ট্রে, ওয়াচ ফেস স্টুডিও, কয়েন, পুরুষ ও মহিলাদের জন্য জরুরী SOS স্মার্ট ওয়াচ (রাস্টিক রোজ)",1144,10,43,https://m.media-amazon.com/images/I/71XeKHAtrUL._AC_UY654_QL65_.jpg,INR,https://www.amazon.in/-/bn/dp/B0CVWZNBYW/,100,,
smart watches,1,B0FJ7D2KBQ,398,"Bouncefit D20 Y68 ফিটনেস ব্যান্ড স্মার্ট ওয়াচ পুরুষ, মহিলা, বালক, বালিকা, বাচ্চাদের জন্য - একক টাচ ইন্টারফেস, জল প্রতিরোধী, ওয়ার্কআউট মোড, কুইক চার্জ স্পোর্টস স্মার্টওয়াচ - জেট ব্ল্যাক (FF)",398,10,44,https://m.media-amazon.com/images/I/61Pn9dl24yL._AC_UY654_QL65_.jpg,INR,https://www.amazon.in/-/bn/dp/B0FJ7D2KBQ/,100,,
smart watches,1,B0DCZ9PRCP,19999,"Amazfit T-Rex 3 আউটডোর রাগড মিলিটারি 48mm স্মার্ট ওয়াচ, বিল্ট ইন GPS, 27 দিনের ব্যাটারি লাইফ, অফলাইন মানচিত্র, 2000 Nits ব্রাইটনেস, 10 ATM জল প্রতিরোধের, AI কোচ, iOS এবং Android এর জন্য (অনিক্স)",19999,10,45,https://m.media-amazon.com/images/I/71GtgMbKvKL._AC_UY654_QL65_.jpg,INR,https://www.amazon.in/-/bn/dp/B0DCZ9PRCP/,100,,
smart watches,1,B0CG1Y3336,2199,"Noise Vortex Plus 1.46 AMOLED ডিসপ্লে, AoD, BT কলিং, স্লিক মেটাল ফিনিশ, 7 দিনের ব্যাটারি লাইফ, 100+ ওয়াচ ফেসেস এবং হেলথ স্যুট (কালো) সহ সমস্ত নতুন OS",2199,10,46,https://m.media-amazon.com/images/I/61QiBo-sPTL._AC_UY654_QL65_.jpg,INR,https://www.amazon.in/-/bn/dp/B0CG1Y3336/,100,,
smart watches,1,B0FLYHGXVJ,3999,"Fastrack Radiant FX4 AMOLED মেটাল স্মার্ট ওয়াচ সিঙ্গেল সিঙ্ক BT কলিং সহ, লিফি সেজ, MYND",3999,10,47,https://m.media-amazon.com/images/I/71YQroz4LDL._AC_UY654_QL65_.jpg,INR,https://www.amazon.in/-/bn/dp/B0FLYHGXVJ/,100,,
smart watches,1,B0FNCQ7MLT,7999,"Noise Pro 6R 1.46"" AMOLED স্মার্ট ওয়াচ, 1000 NITS, AI Pro দ্বারা চালিত, বিল্ট-ইন GPS, Strava ইন্টিগ্রেশন, স্টেইনলেস স্টিল ডায়াল, ভিডিও ওয়াচ ফেস, 3ATM, জরুরী SOS, TWS সংযোগ-ক্রোম ব্ল্যাক",7999,10,48,https://m.media-amazon.com/images/I/71PcN58hiRL._AC_UY654_QL65_.jpg,INR,https://www.amazon.in/-/bn/dp/B0FNCQ7MLT/,100,,
smart watches,1,B0CDPD51YY,280,Acnos Luminous LED ডিসপ্লে ফ্যাশনেবল বাচ্চাদের ডিজিটাল ঘড়ি - ওয়াটারপ্রুফ স্পোর্টস স্কয়ার ইলেক্ট্রনিক LED ঘড়ি ছেলে এবং মেয়েদের জন্য,280,10,49,https://m.media-amazon.com/images/I/71p0rvXWCiL._AC_UY654_QL65_.jpg,INR,https://www.amazon.in/-/bn/dp/B0CDPD51YY/,100,,
smart watches,1,B0BVR8CGJW,1799,"Noise ColorFit Ultra 3 ব্লুটুথ কলিং স্মার্ট ওয়াচ সাথে বৃহত্তম 1.96"" AMOLED ডিসপ্লে, প্রিমিয়াম মেটালিক বিল্ড, ফাংশনাল ক্রাউন, সিলিকন স্ট্র্যাপ সহ জেসচার কন্ট্রোল (টিল ব্লু)",1799,10,50,https://m.media-amazon.com/images/I/71+-rwXfrCL._AC_UY654_QL65_.jpg,INR,https://www.amazon.in/-/bn/dp/B0BVR8CGJW/,100,,
smart watches,1,B0FLQ4QB8C,1399,"HAMMER আল্ট্রা ক্লাসিক 2.01"" সর্বদা প্রদর্শন, ব্লুটুথ কলিং স্মার্ট ওয়াচ, ওয়্যারলেস চার্জিং, 1 এক্সট্রা স্টার্প, জেগে উঠুন, ইন-বিল্ট গেমস, ব্রাইটনেস অ্যাডজাস্টমেন্ট, BP, SpO2, HR মনিটরিং",1399,10,51,https://m.media-amazon.com/images/I/71Z97VjXO4L._AC_UY654_QL65_.jpg,INR,https://www.amazon.in/-/bn/dp/B0FLQ4QB8C/,100,,
smart watches,1,B0FN4C6NPR,349,"MARVIK M I D116 ফিটনেস ব্যান্ড স্মার্ট ওয়াচ পুরুষ, মহিলা, বালক, বালিকা, বাচ্চাদের, সিঙ্গেল টাচ ইন্টারফেস, IP68 ওয়াটারপ্রুফ সাথে ডেইলি অ্যাক্টিভিটি ট্র্যাকার, হার্ট রেট সেন্সর, অ্যান্ড্রয়েড এবং iOS",349,10,52,https://m.media-amazon.com/images/I/51Q74o0dcYL._AC_UY654_QL65_.jpg,INR,https://www.amazon.in/-/bn/dp/B0FN4C6NPR/,100,,
smart watches,1,B0D1M7SFVD,1339,"GameSir Q18 বাচ্চাদের স্মার্ট ওয়াচ 1.44"" TFT ডিসপ্লে 3G / 4G সিম সাপোর্ট, লার্নিং এবং গেমিং অ্যাপস, গিফট ওয়াচ, ওয়াটারপ্রুফ, LBS ট্র্যাকিং/GPS, 2 ওয়ে কলিং স্মার্ট ওয়াচ ছেলে এবং মেয়েদের জন্য (কালো",1339,10,53,https://m.media-amazon.com/images/I/71bgNWjCEML._AC_UY654_QL65_.jpg,INR,https://www.amazon.in/-/bn/dp/B0D1M7SFVD/,100,,
