type,disc,id,competitor_price,product_name,our_price,inventory,demand_score,img_url,timestamp,url,,,
phone,1,B0FHLFB2QW,7999,"realme C71 4G স্মার্টফোন 4GB+64GB কালো, 6.745 inch স্ক্রিন, 90Hz আই কমফোর্ট ডিসপ্লে, 6300mAh ব্যাটারি, 37MP ক্যামেরা, Unisoc T7250 চিপ, IP54",7999,10,137,https://m.media-amazon.com/images/I/51n6biNazbL._AC_UY654_QL65_.jpg,INR,https://www.amazon.in/-/bn/dp/B0FHLFB2QW/,100,,
phone,1,B0FKN3S674,17535,"Motorola G86 Power (কসমিক স্কাই, 8GB RAM + 128GB স্টোরেজ) | 6.7"" 1.5K pOLED ডিসপ্লে | 50MP Sony OIS ক্যামেরা | 6720mAh ব্যাটারি | TurboPower 33W চার্জিং | ডাইমেনসিটি 7400 প্রসেসর",17535,10,138,https://m.media-amazon.com/images/I/71BxTKhVCEL._AC_UY654_QL65_.jpg,INR,https://www.amazon.in/-/bn/dp/B0FKN3S674/,100,,
phone,1,B0FDKZMMYC,109999,"Samsung Galaxy Z Flip7 5G স্মার্টফোন Galaxy AI সহ (ব্লু শ্যাডো, 12GB RAM, 256GB স্টোরেজ), 50MP হাই-রেজোলিউশন ক্যামেরা সহ আল্ট্রা স্লিক ডিজাইন, Exynos 2500, Google Gemini",109999,10,139,https://m.media-amazon.com/images/I/515hudzgEuL._AC_UY654_QL65_.jpg,INR,https://www.amazon.in/-/bn/dp/B0FDKZMMYC/,100,,
phone,1,B0FQFV2XKS,149900,"iPhone 17 Pro Max 256 GB: 17.42 cm (6.9″) প্রোমোশন সহ ডিসপ্লে, A19 Pro চিপ, যেকোনো iPhone এর সেরা ব্যাটারি লাইফ, প্রো ফিউশন ক্যামেরা সিস্টেম, সেন্টার স্টেজ ফ্রন্ট ক্যামেরা; গাঢ় নীল",149900,10,140,https://m.media-amazon.com/images/I/71R8VsJ07nL._AC_UY654_QL65_.jpg,INR,https://www.amazon.in/-/bn/dp/B0FQFV2XKS/,100,,
phone,1,B0G2B39Q4H,15499,REDMI 15C 5G মিডনাইট ব্ল্যাক 8GB + 128GB | রয়্যাল ডিজাইন | বিশাল 6000mAh ব্যাটারি | সেগমেন্টের বৃহত্তম 17.53cm ডিসপ্লে 120Hz পর্যন্ত | MediaTek Dimensity 6300 | 33W দ্রুত চার্জিং | 50MP AI ডুয়াল,15499,10,141,https://m.media-amazon.com/images/I/71hOqmhz9RL._AC_UY654_QL65_.jpg,INR,https://www.amazon.in/dp/B0G2B39Q4H/,100,,
phone,1,B0D1FL5FVK,698,"Multipurpose Desktop Phone Wall Mounted Landline Caller ID Telephone Corded Phone for Home Office Hotel (Black, KX-T666)",698,10,142,https://m.media-amazon.com/images/I/416t1UaAQDL._AC_UY436_QL65_.jpg,INR,https://www.amazon.in/dp/B0D1FL5FVK/,100,,
phone,1,B0FQF5DG3P,154900,"iPhone 17 Pro 512 GB: 15.93 cm (6.3″) 120Hz পর্যন্ত প্রোমোশন সহ ডিসপ্লে, A19 Pro চিপ, ব্রেকথ্রু ব্যাটারি লাইফ, সেন্টার স্টেজ ফ্রন্ট ক্যামেরা সহ প্রো ফিউশন ক্যামেরা সিস্টেম; গাঢ় নীল",154900,10,143,https://m.media-amazon.com/images/I/618vU2qKXQL._AC_UY654_QL65_.jpg,INR,https://www.amazon.in/-/bn/dp/B0FQF5DG3P/,100,,
phone,1,B0FTFCD25N,13990,"OPPO K13x 5G 6000mAh এবং 45W SUPERVOOC চার্জার এবং AI (ব্রিজ ব্লু, 128 GB) (6 GB RAM)",13990,10,144,https://m.media-amazon.com/images/I/41fosPkqZAL._AC_UY389_QL65_.jpg,INR,https://www.amazon.in/-/bn/dp/B0FTFCD25N/,100,,
phone,1,B0DYDQ7PDN,46999,"Samsung Galaxy A56 5G (Awesome Olive, 12GB, 256GB) | মেটাল ফ্রেম | Gemini Live | Awesome Intelligence (AI): সার্কল টু সার্চ, ইনস্ট্যান্ট স্লো-মো, অটো-ট্রিম, অবজেক্ট ইরেজার | ফ্ল্যাগশিপ গ্রেড ক্যামেরা",46999,10,145,https://m.media-amazon.com/images/I/61lFzxXjo1L._AC_UY654_QL65_.jpg,INR,https://www.amazon.in/-/bn/dp/B0DYDQ7PDN/,100,,
phone,1,B0F8TQ1PLK,8799,POCO C75 5G Aqua Bliss|4GB RAM 128GB ROM|6.88 inch HD+ ডিসপ্লে|50MP ক্যামেরা|5160 mAh ব্যাটারি,8799,10,146,https://m.media-amazon.com/images/I/61DnXnpjn1L._AC_UY654_QL65_.jpg,INR,https://www.amazon.in/-/bn/dp/B0F8TQ1PLK/,100,,
phone,1,B0FX3XH7CD,16499,"realme 15X 5G স্মার্টফোন 6GB RAM 128GB ROM, 6.8 inch 144Hz ডিসপ্লে, 7000 0mAh ব্যাটারি, 60W ফাস্ট চার্জিং IP69 Pro ওয়াটারপ্রুফ ডাইমেনসিটি 6300 6nm অক্টা-কোর চিপসেট প্রসেসর (মেরিন ব্লু)",16499,10,147,https://m.media-amazon.com/images/I/713S0qZySfL._AC_UY654_QL65_.jpg,INR,https://www.amazon.in/-/bn/dp/B0FX3XH7CD/,100,,
phone,1,B0F9X6997B,27999,"Vivo Y400 Pro 5G (নেবুলা পার্পল, 8GB RAM, 256GB স্টোরেজ) কোনো খরচ ছাড়া EMI/অতিরিক্ত এক্সচেঞ্জ অফার সহ",27999,10,148,https://m.media-amazon.com/images/I/71oupGGMKlL._AC_UY654_QL65_.jpg,INR,https://www.amazon.in/-/bn/dp/B0F9X6997B/,100,,
phone,1,B0B3CZ7P4V,29999,"OnePlus Nord 2T 5G (গ্রে শ্যাডো, 12GB স্টোরেজ, 256GB স্টোরেজ)",29999,10,149,https://m.media-amazon.com/images/I/61QiheOiObL._AC_UY654_QL65_.jpg,INR,https://www.amazon.in/-/bn/dp/B0B3CZ7P4V/,100,,
phone,1,B0F13PYCJD,1627,"Lava Gem 2025 ডুয়াল সিম কিপ্যাড ফোন (2.8"" ডিসপ্লে, ক্যামেরা এবং ফ্ল্যাশ) | 2575mAh স্মার্ট AI শক্তিশালী ব্যাটারি | ওয়্যারলেস FM এবং রেকর্ডিং | স্টেরিও স্পিকার | কল রেকর্ডিং (কালো গোল্ড)",1627,10,150,https://m.media-amazon.com/images/I/61WWSMaP9GL._AC_UY654_QL65_.jpg,INR,https://www.amazon.in/-/bn/dp/B0F13PYCJD/,100,,
phone,1,B0C6QST5KC,999,"LED Indication Corded Button Greco Telephone OHO-617 Caller ID Flash Button, Redial and Pause Button Landline Phone for Office, School, Hospital, Hotel (1Pcs)",999,10,151,https://m.media-amazon.com/images/I/41gRU--ekiL._AC_UY436_QL65_.jpg,INR,https://www.amazon.in/dp/B0C6QST5KC/,100,,
phone,1,B0FQPMXLMZ,2499,"Drumstone Desktop Landline Phone with SIM Card Slot – Wireless GSM Desk Phone with Caller ID, Hands-Free Function, Clear Sound & LCD Display for Home, Office, Hotel & Business Use",2499,10,152,https://m.media-amazon.com/images/I/61AJ4tiNa+L._AC_UY654_QL65_.jpg,INR,https://www.amazon.in/dp/B0FQPMXLMZ/,100,,
phone,1,B0F3V2TCLL,14999,"Infinix Note 50x 5G+ (Enchanted Purple, 8GB RAM, 128GB স্টোরেজ) | MediaTek D7300 Ultimate | 90FPS BGMI গেমিং | 5500mAH ব্যাটারি 45W ফাস্টচার্জ সহ | 650K+ AnTuTu AI",14999,10,153,https://m.media-amazon.com/images/I/713frMXminL._AC_UY654_QL65_.jpg,INR,https://www.amazon.in/-/bn/dp/B0F3V2TCLL/,100,,
phone,1,B0G4HYD718,20299,"নাথিং ফোন (3a) লাইট (নীল, 128 GB) (8 GB RAM)",20299,10,154,https://m.media-amazon.com/images/I/81iPJsqxMoL._AC_UY654_QL65_.jpg,INR,https://www.amazon.in/-/bn/dp/B0G4HYD718/,100,,
phone,1,B0FT3J2W97,24998,"Lava Agni 4 5G (8GB RAM, 256GB স্টোরেজ, ফ্যান্টম ব্ল্যাক) | মেটাল বডি | MTK ডাইমেনসিটি 8350 প্রসেসর (1.4Mn+ Antutu) | 1.5K AMOLED ডিসপ্লে | 50MP OIS ক্যামেরা | LPDDR5X RAM | UFS 4.0 | 4K@ 60fps | Vayu",24998,10,155,https://m.media-amazon.com/images/I/61n757CiYWL._AC_UY654_QL65_.jpg,INR,https://www.amazon.in/-/bn/dp/B0FT3J2W97/,100,,
phone,1,B0FMDZJM2T,25350,"realme P4 pro 5G স্মার্টফোন 8+128GB বার্চ উড, 6.8-inch স্ক্রিন, 144Hz ডিসপ্লে, 7000mAh ব্যাটারি, 80W আল্ট্রা চার্জ, 108MP AI ক্যামেরা, Snapdragon 7 Gen 4 চিপসেট, IP65",25350,10,156,https://m.media-amazon.com/images/I/51xgbmXJAnL._AC_UY654_QL65_.jpg,INR,https://www.amazon.in/-/bn/dp/B0FMDZJM2T/,100,,
phone,1,B0G3X48FQ4,20299,"নাথিং ফোন (3a লাইট) (কালো, 128 GB) (8 GB RAM)",20299,10,157,https://m.media-amazon.com/images/I/71dZBla7wUL._AC_UY654_QL65_.jpg,INR,https://www.amazon.in/-/bn/dp/B0G3X48FQ4/,,,
phone,1,B0FL7ZRS5G,10999,"Tecno Spark GO 5G (স্কাই ব্লু, 4GB+128GB) | 6000mAh ব্যাটারি সহ স্লিমস্ট স্মার্টফোন | Ella AI ভারতীয় ভাষার সাপোর্ট সহ* | IP64 ধুলো এবং জল প্রতিরোধী",10999,10,158,https://m.media-amazon.com/images/I/51stkIj-ICL._AC_UY654_QL65_.jpg,INR,https://www.amazon.in/-/bn/dp/B0FL7ZRS5G/,100,,
phone,1,B0FHM2KCNG,7899,"realme C71 4G স্মার্টফোন 4GB+64GB নীল, 6.745 inch স্ক্রিন, 90Hz আই কমফোর্ট ডিসপ্লে, 6300mAh ব্যাটারি, 37MP ক্যামেরা, Unisoc T7250 চিপ, IP54",7899,10,159,https://m.media-amazon.com/images/I/51yYGfR3hLL._AC_UY654_QL65_.jpg,INR,https://www.amazon.in/-/bn/dp/B0FHM2KCNG/,100,,
phone,1,B0FQG1TPG9,138890,"iPhone Air 1 TB: পাতলা iPhone সর্বদা, 16.63 cm (6.5″) ডিসপ্লে 120Hz পর্যন্ত প্রোমোশন সহ, শক্তিশালী A19 Pro চিপ, সেন্টার স্টেজ ফ্রন্ট ক্যামেরা, সারাদিনের ব্যাটারি লাইফ; আকাশী নীল",138890,10,160,https://m.media-amazon.com/images/I/61Ce-6B6x+L._AC_UY654_QL65_.jpg,INR,https://www.amazon.in/-/bn/dp/B0FQG1TPG9/,100,,
phone,1,B0G2B251KD,13999,REDMI 15C 5G মুনলাইট ব্লু 6GB + 128GB | রয়্যাল ডিজাইন | বিশাল 6000mAh ব্যাটারি | সেগমেন্টের বৃহত্তম ডিসপ্লে 17.53cm 120Hz পর্যন্ত | MediaTek Dimensity 6300 | 33W দ্রুত চার্জিং | 50MP AI ডুয়াল,13999,10,161,https://m.media-amazon.com/images/I/81eElSw1tJL._AC_UY654_QL65_.jpg,INR,https://www.amazon.in/dp/B0G2B251KD/,100,,
phone,1,B0DPS7FB4J,63999,OnePlus 13 | OnePlus AI সহ স্মার্ট | লাইফটাইম ডিসপ্লে ওয়ারেন্টি |12GB RAM 256GB স্টোরেজ মিডনাইট ওশান | BGMS 2025 এর জন্য অফিসিয়াল স্মার্টফোন,63999,10,162,https://m.media-amazon.com/images/I/71N4hshhfNL._AC_UY654_QL65_.jpg,INR,https://www.amazon.in/dp/B0DPS7FB4J/,100,,
phone,1,B0FHM2KCNG,7899,"realme C71 4G স্মার্টফোন 4GB+64GB নীল, 6.745 inch স্ক্রিন, 90Hz আই কমফোর্ট ডিসপ্লে, 6300mAh ব্যাটারি, 37MP ক্যামেরা, Unisoc T7250 চিপ, IP54",7899,10,163,https://m.media-amazon.com/images/I/51yYGfR3hLL._AC_UY654_QL65_.jpg,INR,https://www.amazon.in/-/bn/dp/B0FHM2KCNG/,100,,
phone,1,B0FQG1TPG9,138890,"iPhone Air 1 TB: পাতলা iPhone সর্বদা, 16.63 cm (6.5″) ডিসপ্লে 120Hz পর্যন্ত প্রোমোশন সহ, শক্তিশালী A19 Pro চিপ, সেন্টার স্টেজ ফ্রন্ট ক্যামেরা, সারাদিনের ব্যাটারি লাইফ; আকাশী নীল",138890,10,164,https://m.media-amazon.com/images/I/61Ce-6B6x+L._AC_UY654_QL65_.jpg,INR,https://www.amazon.in/-/bn/dp/B0FQG1TPG9/,100,,
phone,1,B0FKN95GMN,17348,"Motorola g86 Power 5G (প্যানটোন স্পেলবাউন্ড, 8GB RAM, 128GB স্টোরেজ) | 6.7"" 1.5K pOLED ডিসপ্লে | 50MP Sony OIS ক্যামেরা | 6720mAh ব্যাটারি | TurboPower 33W চার্জিং | ডাইমেনসিটি 7400 প্রসেসর",17348,10,165,https://m.media-amazon.com/images/I/4127pxUDQqL._AC_UY654_QL65_.jpg,INR,https://www.amazon.in/-/bn/dp/B0FKN95GMN/,100,,
phone,1,B0FL7ZRS5G,10999,"Tecno Spark GO 5G (স্কাই ব্লু, 4GB+128GB) | 6000mAh ব্যাটারি সহ স্লিমস্ট স্মার্টফোন | Ella AI ভারতীয় ভাষার সাপোর্ট সহ* | IP64 ধুলো এবং জল প্রতিরোধী",10999,10,166,https://m.media-amazon.com/images/I/51stkIj-ICL._AC_UY654_QL65_.jpg,INR,https://www.amazon.in/-/bn/dp/B0FL7ZRS5G/,100,,
phone,1,B0FTR5NGHJ,72999,OnePlus 15 | 12GB+256GB | অসীম কালো | ভারতের প্রথম Snapdragon 8 Elite Gen 5 | 7300mAh ব্যাটারি | ব্যক্তিগতকৃত AI | গেম-চেঞ্জিং 165Hz ডিসপ্লে | 4K 120fps Dolby Vision সহ ট্রিপল 50MP ক্যামেরা,72999,10,167,https://m.media-amazon.com/images/I/61KXgizurpL._AC_UY654_QL65_.jpg,INR,https://www.amazon.in/-/bn/dp/B0FTR5NGHJ/,100,,
phone,1,B0F7RB8NNL,54500,"Nothing Phone (3), কালো (16GB, 512 GB)",54500,10,168,https://m.media-amazon.com/images/I/51E1ItTOFGL._AC_UY645_QL65_.jpg,INR,https://www.amazon.in/-/bn/dp/B0F7RB8NNL/,100,,
phone,1,B0D37Y31YB,24740,"Motorola Edge 50 Pro (কালো সৌন্দর্য, 12+256)",24740,10,169,https://m.media-amazon.com/images/I/51RJVdKC9lL._AC_UY654_QL65_.jpg,INR,https://www.amazon.in/-/bn/dp/B0D37Y31YB/,100,,
phone,1,B0F13PYCJD,1627,"Lava Gem 2025 ডুয়াল সিম কিপ্যাড ফোন (2.8"" ডিসপ্লে, ক্যামেরা এবং ফ্ল্যাশ) | 2575mAh স্মার্ট AI শক্তিশালী ব্যাটারি | ওয়্যারলেস FM এবং রেকর্ডিং | স্টেরিও স্পিকার | কল রেকর্ডিং (কালো গোল্ড)",1627,10,170,https://m.media-amazon.com/images/I/61WWSMaP9GL._AC_UY654_QL65_.jpg,INR,https://www.amazon.in/-/bn/dp/B0F13PYCJD/,100,,
phone,1,B0FTRYH3XM,72999,OnePlus 15 | 12GB+256GB | আল্ট্রা ভায়োলেট | ভারতের প্রথম Snapdragon 8 Elite Gen 5 | 7300mAh ব্যাটারি | পার্সোনালাইজড AI | গেম-চেঞ্জিং 165Hz ডিসপ্লে | 4K 120fps Dolby Vision সহ ট্রিপল 50MP ক্যামেরা,72999,10,171,https://m.media-amazon.com/images/I/61-FxePR8IL._AC_UY654_QL65_.jpg,INR,https://www.amazon.in/dp/B0FTRYH3XM/,100,,
phone,1,B0FZSWZZW2,47998,OnePlus 15R | 12GB+256GB | চারকোল ব্ল্যাক | বিশ্বের প্রথম Snapdragon 8 Gen 5 | 7400mAh ব্যাটারি | ব্যক্তিগতকৃত AI | গেম-চেঞ্জিং 165Hz ডিসপ্লে | IP68 IP69 IP66 এবং IP69K | 4K 120fps ভিডিও,47998,10,172,https://m.media-amazon.com/images/I/61AsNTuJ6mL._AC_UY654_QL65_.jpg,INR,https://www.amazon.in/dp/B0FZSWZZW2/,100,,
phone,1,B09WRKHWP7,34999,"OnePlus 10R 5G (ফরেস্ট গ্রিন, 12GB RAM, 256GB স্টোরেজ, 80W SuperVOOC)",34999,10,173,https://m.media-amazon.com/images/I/71mef2tI0zL._AC_UY654_QL65_.jpg,INR,https://www.amazon.in/-/bn/dp/B09WRKHWP7/,100,,
phone,1,B0FHWKYR2P,14885,realme 14X 5G স্মার্টফোন ডাইমেনসিটি 6300 6nm চিপ 8GB RAM 128GB ROM 6.67 Inch HD+ IP69 ওয়াটারপ্রুফ 6000mAh ব্যাটারি 45W ফাস্ট চার্জ সাপোর্ট ফিঙ্গারপ্রিন্ট GPS WiFi ব্লুটুথ গোল্ড,14885,10,174,https://m.media-amazon.com/images/I/612e33RDElL._AC_UY654_QL65_.jpg,INR,https://www.amazon.in/-/bn/dp/B0FHWKYR2P/,100,,
phone,1,B0DSKNLFBG,80999,"Samsung Galaxy S25 5G স্মার্টফোন Galaxy AI সহ (সিলভার শ্যাডো, 12GB RAM, 256GB স্টোরেজ), Snapdragon 8 Elite, প্রোভিসুয়াল ইঞ্জিন সহ 50 MP ক্যামেরা এবং 4000mAh ব্যাটারি",80999,10,175,https://m.media-amazon.com/images/I/61D3EdXKG5L._AC_UY654_QL65_.jpg,INR,https://www.amazon.in/-/bn/dp/B0DSKNLFBG/,100,,
phone,1,B0FG7F6C1C,14399,"OPPO K13x 5G 6000mAh এবং 45W SUPERVOOC চার্জার এবং AI (সানসেট পিচ, 128 GB) (6 GB RAM)",14399,10,176,https://m.media-amazon.com/images/I/51G2HmZSLJL._AC_UY654_QL65_.jpg,INR,https://www.amazon.in/-/bn/dp/B0FG7F6C1C/,100,,
phone,1,B0F9YVG9C9,1099,"Philips অল-নিউ E2103 স্লিক এবং স্টাইলিশ | কিপ্যাড মোবাইল 1.77"" স্ক্রিন সহ|1000 MAH ব্যাটারি | 2030mm স্পিকার| ওয়্যারলেস FM | ব্রাইট টর্চ |কালো",1099,10,177,https://m.media-amazon.com/images/I/719ko4Tgu+L._AC_UY654_QL65_.jpg,INR,https://www.amazon.in/-/bn/dp/B0F9YVG9C9/,100,,
phone,1,B0DR5D79DQ,16986,"POCO M7 Pro 5G, ল্যাভেন্ডার ফ্রস্ট (8GB, 256GB)",16986,10,178,https://m.media-amazon.com/images/I/51MI2CEBcUL._AC_UY654_QL65_.jpg,INR,https://www.amazon.in/-/bn/dp/B0DR5D79DQ/,100,,
phone,1,B0FMRLNSFQ,14599,"Pova 7 5G (ওসিস গ্রিন, 8GB+256GB) | মাল্টি-ফাংশনাল ডেল্টা লাইট ইন্টারফেস | সেগমেন্টের সেরা AI স্মার্টফোন | 45W সহ বিগ 6000mAh ব্যাটারি | সুপার স্মুথ 144Hz 6.78"" FHD+ ডিসপ্লে | 4X4 MIMO সাপোর্ট করে",14599,10,179,https://m.media-amazon.com/images/I/61-JsE1+DQL._AC_UY654_QL65_.jpg,INR,https://www.amazon.in/-/bn/dp/B0FMRLNSFQ/,100,,
phone,1,B0FNX24L38,8499,"Lava Bold N1 5G (রয়্যাল ব্লু, 4GB RAM, 128GB স্টোরেজ) | বড় 6.75"" HD+ নচ ডিসপ্লে | Octacore 5G প্রসেসর | 13 MP AI ক্যামেরা | 5000 mAh ব্যাটারি | IP54 রেটেড ডাস্ট এবং ওয়াটার স্প্ল্যাশ প্রুফ",8499,10,180,https://m.media-amazon.com/images/I/71D93r4ATWL._AC_UY654_QL65_.jpg,INR,https://www.amazon.in/-/bn/dp/B0FNX24L38/,100,,
headphones,1,B0BZHT8T7T,1599,"boAt Rockerz 551ANC, 100HRS ব্যাটারি, হাইব্রিড ANC(~35Db), ফাস্ট চার্জ, পরিবেষ্টিত সাউন্ড মোড এবং ডুয়াল EQ মোড, Enx টেক, ব্লুটুথ হেডফোন, মাইকের সাথে ওভার ইয়ার ওয়্যারলেস হেডফোন (সেজ গ্রিন)",1599,10,1,https://m.media-amazon.com/images/I/61WFLydWqpL._AC_UY654_QL65_.jpg,INR,https://www.amazon.in/-/bn/dp/B0BZHT8T7T/,100,,
headphones,1,B07L8KV2KC,799,"জেব্রনিক্স জেব-থান্ডার ওয়্যারলেস বিটি হেডফোনটি 40 মিমি ড্রাইভার, এউএক্স কানেক্টিভিটি, এফএম, বিল ফাংশন, 9 ঘন্টা*, প্লেব্যাক সময় এবং মাইক্রো এসডি কার্ড সমর্থন করে",799,10,2,https://m.media-amazon.com/images/I/61i7ivBDe3L._AC_UY654_QL65_.jpg,INR,https://www.amazon.in/-/bn/dp/B07L8KV2KC/,100,,
headphones,1,B09R24HMNW,139,"ZEBRONICS Zeb-Bro ইন-ইয়ার ওয়্যার্ড ইয়ারফোন মাইকের সাথে, 3.5mm অডিও জ্যাক, 10mm ড্রাইভার, ফোন/ট্যাবলেট সামঞ্জস্যপূর্ণ(নীল)",139,10,3,https://m.media-amazon.com/images/I/61+5q4oGJWL._AC_UY654_QL65_.jpg,INR,https://www.amazon.in/-/bn/dp/B09R24HMNW/,100,,
headphones,1,B0FGTZ19JS,799,"pTron Studio Evo 70hrs Playtime Wireless Over Ear Headphones with HD Mic, Low-Latency Game/Movie/Music Modes, Punchy Bass, BT5.3, Dual Device Pairing, Voice Assistant & Type-C Fast Charging (Beige)",799,10,4,https://m.media-amazon.com/images/I/51+Zl86jLkL._AC_UY654_QL65_.jpg,INR,https://www.amazon.in/-/bn/dp/B0FGTZ19JS/,100,,
headphones,1,B0DGTSRX3R,1799,"boAt Rockerz 480, RGB LEDs,6 লাইট মোড, 40mm ড্রাইভার, বিস্ট মোড, 60H ব্যাটারি, ENx Tech, অ্যাপ সাপোর্টের মাধ্যমে স্ট্রিম বিজ্ঞাপন ফ্রি সঙ্গীত, ব্লুটুথ হেডফোন, মাইকের সাথে ওয়্যারলেস ওভার ইয়ার হেডফোন",1799,10,5,https://m.media-amazon.com/images/I/711l4y8aNlL._AC_UY654_QL65_.jpg,INR,https://www.amazon.in/-/bn/dp/B0DGTSRX3R/,100,,
headphones,1,B0BS1RT9S2,3989,"Sony WH-CH520 ওয়্যারলেস ব্লুটুথ হেডফোন অন ইয়ার মাইক সহ, 50 ঘন্টা পর্যন্ত ব্যাটারি, কুইক চার্জ, DSEE আপস্কেল, মাল্টিপয়েন্ট সংযোগ, ভয়েস অ্যাসিস্ট্যান্ট, কাস্টমাইজড EQ-ব্লু",3989,10,6,https://m.media-amazon.com/images/I/41JACWT-wWL._AC_UY654_QL65_.jpg,INR,https://www.amazon.in/-/bn/dp/B0BS1RT9S2/,100,,
headphones,1,B0BZHRB9J1,1599,"boAt Rockerz 551ANC ব্লুটুথ হাইব্রিড অ্যাক্টিভ নয়েজ ক্যান্সেলেশন ওভার ইয়ার হেডফোন 100 ঘণ্টা পর্যন্ত প্লেটাইম, ASAP চার্জ, পরিবেষ্টিত সাউন্ড মোড এবং ডুয়াল EQ মোড, Enx প্রযুক্তি (স্টেলার ব্ল্যাক)",1599,10,7,https://m.media-amazon.com/images/I/61BrerJ+yML._AC_UY654_QL65_.jpg,INR,https://www.amazon.in/-/bn/dp/B0BZHRB9J1/,100,,
headphones,1,B0FC2Y8XYF,1199,"boAt 2025 Launch Rockerz 411, 40Ms লো লেটেন্সি, 40Hrs ব্যাটারি, 40Mm ড্রাইভার, ENx Tech, অ্যাপ সাপোর্টের মাধ্যমে স্ট্রিম বিজ্ঞাপন মুক্ত সঙ্গীত, ব্লুটুথ হেডফোন, মাইকের সাথে ওয়্যারলেস ওভার ইয়ার হেডফোন",1199,10,8,https://m.media-amazon.com/images/I/71QdB7hDCAL._AC_UY654_QL65_.jpg,INR,https://www.amazon.in/-/bn/dp/B0FC2Y8XYF/,100,,
headphones,1,B0B4G44RFS,499,"Zebronics Zeb-Storm অন ইয়ার ওয়্যার্ড হেডফোন 3.5mm জ্যাক সহ, কলিংয়ের জন্য অন্তর্নির্মিত মাইক্রোফোন, 1.5 মিটার কেবল, নরম কানের কুশন, সামঞ্জস্যযোগ্য হেডব্যান্ড, ভাঁজযোগ্য কানের কাপ এবং হালকা ওজনের",499,10,9,https://m.media-amazon.com/images/I/61FrvQMXxJL._AC_UY654_QL65_.jpg,INR,https://www.amazon.in/-/bn/dp/B0B4G44RFS/,100,,
headphones,1,B071Z8M4KX,349,মাইক সহ boAt Bassheads 100 ইয়ার ওয়্যারড ইয়ারফোন,349,10,10,https://m.media-amazon.com/images/I/513ugd16C6L._AC_UY654_QL65_.jpg,INR,https://www.amazon.in/-/bn/dp/B071Z8M4KX/,100,,
headphones,1,B0B1PXM75C,1499,"50 ঘন্টা প্লেটাইম, কম লেটেন্সি (40ms পর্যন্ত), 4 টি প্লে মোড, ডুয়াল পেয়ারিং, BT v5.3 (সেরিন ব্লু) সহ নতুন লঞ্চ হওয়া নয়েজ টু অন-ইয়ার হেডফোন",1499,10,11,https://m.media-amazon.com/images/I/517lSvEVVsL._AC_UY654_QL65_.jpg,INR,https://www.amazon.in/-/bn/dp/B0B1PXM75C/,100,,
headphones,1,B08QTYYNDN,2499,"JBL Tune 510BT, মাইকের সাথে অন-ইয়ার ওয়্যারলেস হেডফোন, 40 ঘন্টা অবধি প্লেটাইম, খাঁটি বেস, দ্রুত চার্জিং, ডুয়াল পেয়ারিং, ব্লুটুথ 5.0 এবং মোবাইল ফোনের জন্য ভয়েস অ্যাসিস্ট্যান্ট সাপোর্ট (কালো)",2499,10,12,https://m.media-amazon.com/images/I/61kFL7ywsZS._AC_UY654_QL65_.jpg,INR,https://www.amazon.in/-/bn/dp/B08QTYYNDN/,100,,
headphones,1,B0CWVX1GNX,14557,"Sony ULT Wear WH-ULT900N নয়েজ ক্যান্সেলেশন ওয়্যারলেস ব্লুটুথ ওভার ইয়ার হেডফোনগুলি ম্যাসিভ বেস সহ, 50 ঘন্টা পর্যন্ত ব্যাটারি-ব্ল্যাক",14557,10,13,https://m.media-amazon.com/images/I/610DB8Cwm7L._AC_UY654_QL65_.jpg,INR,https://www.amazon.in/-/bn/dp/B0CWVX1GNX/,100,,
headphones,1,B00KGZZ824,868,Sonyহেডফোন MDR,868,10,14,https://m.media-amazon.com/images/I/41BoLKMYjnL._AC_UY654_QL65_.jpg,INR,https://www.amazon.in/-/bn/dp/B00KGZZ824/,100,,
